headline,url
Border and Ukraine aid bill in jeopardy in Senate due to Republican opposition,https://english.elpais.com/usa/2024-02-06/border-and-ukraine-aid-bill-in-jeopardy-in-senate-due-to-staunch-republican-opposition.html
Nikki Haley is trounced by the ‘none of these candidates’ option in Nevada’s Republican primary,https://english.elpais.com/usa/2024-02-07/nikki-haley-is-trounced-by-the-none-of-these-candidates-option-in-nevadas-republican-primary.html
Closing a chapter of historical mourning: US museums accelerate the return of human remains to Native tribes,https://english.elpais.com/culture/2024-02-07/closing-a-chapter-of-historical-mourning-us-museums-accelerate-the-return-of-human-remains-to-native-tribes.html
Hamas proposes 135-day ceasefire in Gaza to exchange Israeli hostages for Palestinian prisoners ,https://english.elpais.com/international/2024-02-07/hamas-proposes-135-day-ceasefire-in-gaza-to-exchange-israeli-hostages-for-palestinian-prisoners.html
Gaza reporter recalls captivity in Israel: ‘The worst 33 days of my life’,https://english.elpais.com/international/2024-02-07/gaza-reporter-recalls-captivity-in-israel-the-worst-33-days-of-my-life.html
Inside Nayib Bukele’s Alcatraz: ‘It is impossible to escape. These psychopaths are going to spend their whole lives behind bars here’,https://english.elpais.com/international/2024-02-07/inside-nayib-bukeles-alcatraz-it-is-impossible-to-escape-these-psychopaths-are-going-to-spend-their-whole-lives-behind-bars-here.html
Argentina’s Milei declares war on the opposition after his mega-bill to dismantle the state is rejected,https://english.elpais.com/international/2024-02-07/argentinas-javier-milei-declares-war-on-the-opposition-after-his-megalaw-to-dismantle-the-state-is-rejected.html
Bombings at Pakistani political offices kill at least 29 a day before parliamentary elections ,https://english.elpais.com/international/2024-02-07/bombings-at-pakistani-political-offices-kill-at-least-29-a-day-before-parliamentary-elections.html
Why the fires in Chile destroyed so many lives,https://english.elpais.com/international/2024-02-07/why-the-fires-in-chile-destroyed-so-many-lives.html
The European countryside shows its strength,https://english.elpais.com/international/2024-02-06/the-european-countryside-shows-its-strength.html
Vladimir Putin grants former Fox host Tucker Carlson his first interview with a Western broadcaster,https://english.elpais.com/international/2024-02-07/vladimir-putin-grants-former-fox-host-tucker-carlson-his-first-interview-with-a-western-broadcaster.html
Biden is sending aides to Michigan to see Arab American and Muslim leaders over the Israel-Hamas war ,https://english.elpais.com/usa/2024-02-07/biden-is-sending-aides-to-michigan-to-see-arab-american-and-muslim-leaders-over-the-israel-hamas-war.html
Republicans fail in their attempt to impeach Secretary of Homeland Security Mayorkas,https://english.elpais.com/usa/2024-02-07/republicans-fail-in-their-attempt-to-impeach-secretary-of-homeland-security-alejandro-mayorkas.html
"Biden sets tighter standards for deadly soot pollution from tailpipes, smokestacks ",https://english.elpais.com/climate/2024-02-07/biden-sets-tighter-standards-for-deadly-soot-pollution-from-tailpipes-smokestacks.html
Living among the ruins of the earthquake in Turkey a year later,https://english.elpais.com/international/2024-02-07/living-among-the-ruins-of-the-earthquake-in-turkey-a-year-later.html
Sebastián Piñera: The millionaire politician who liked to gamble and win,https://english.elpais.com/international/2024-02-07/sebastian-pinera-the-millionaire-politician-who-liked-to-gamble-and-win.html
How James Gandolfini’s addictions to alcohol and drugs caused chaos during filming of ‘The Sopranos’,https://english.elpais.com/culture/2024-02-07/how-james-gandolfinis-addictions-to-alcohol-and-drugs-caused-chaos-during-filming-of-the-sopranos.html
Felicity Huffman returns to acting after the college admissions scandal that landed her in jail: ‘It’s sort of like your old life died and you died with it’,https://english.elpais.com/people/2024-02-07/felicity-huffman-returns-to-acting-after-the-college-admissions-scandal-that-landed-her-in-jail-its-sort-of-like-your-old-life-died-and-you-died-with-it.html
‘Mandalorian’ actress Gina Carano sues Disney for firing her over Holocaust post ,https://english.elpais.com/people/2024-02-07/mandalorian-actress-gina-carano-sues-disney-for-firing-her-over-holocaust-post.html
Why do the effects of Botox last for less and less time? The mystery that has aesthetic medicine perplexed,https://english.elpais.com/health/2024-02-07/why-do-the-effects-of-botox-last-for-less-and-less-time-the-mystery-that-has-aesthetic-medicine-perplexed.html
"Madrid, the new launchpad for migration from Africa to the United States",https://english.elpais.com/international/2024-02-06/madrid-the-new-launchpad-for-migration-from-africa-to-the-united-states.html
"Elon, the monkeys and you: the atrocity of giving up control of our thoughts",https://english.elpais.com/technology/2024-02-06/elon-the-monkeys-and-you-the-atrocity-of-giving-up-control-of-our-thoughts.html
A million-dollar project against familial cancer aims to take thousands of people out of the ‘genetic purgatory’,https://english.elpais.com/health/2024-02-05/a-million-dollar-project-against-familial-cancer-aims-to-take-thousands-of-people-out-of-the-genetic-purgatory.html
A biologist attacked by the bacteria that devours human flesh: ‘It looks like a shark bite’,https://english.elpais.com/science-tech/2024-02-06/a-biologist-attacked-by-the-bacteria-that-devours-human-flesh-it-looks-like-a-shark-bite.html
Saturn’s Death Star-looking moon may have vast underground ocean ,https://english.elpais.com/science-tech/2024-02-07/saturns-death-star-looking-moon-may-have-vast-underground-ocean.html
An economic paradox: When savings are both a good and a bad idea,https://english.elpais.com/economy-and-business/2024-02-06/an-economic-paradox-when-savings-are-both-a-good-and-a-bad-idea.html
"China replaces its top securities regulator, moving to reassure investors and end a market slump ",https://english.elpais.com/economy-and-business/2024-02-07/china-replaces-its-top-securities-regulator-moving-to-reassure-investors-and-end-a-market-slump.html
IRS expects to collect hundreds of billions more in overdue and unpaid taxes thanks to new funding ,https://english.elpais.com/economy-and-business/2024-02-06/irs-expects-to-collect-hundreds-of-billions-more-in-overdue-and-unpaid-taxes-thanks-to-new-funding.html
"Postal Service, once chided for slow adoption of EVs, announces plan to cut greenhouse gas emissions ",https://english.elpais.com/climate/2024-02-06/postal-service-once-chided-for-slow-adoption-of-evs-announces-plan-to-cut-greenhouse-gas-emissions.html
"Sword-swallowing, running backwards or rowing a giant pumpkin: The latest Guinness World Records",https://english.elpais.com/lifestyle/2024-02-06/sword-swallowing-running-backwards-or-rowing-a-giant-pumpkin-the-latest-guinness-world-records.html
A day in the life of a private chef: A trend that is sweeping social media  ,https://english.elpais.com/lifestyle/2024-02-06/a-day-in-the-life-of-a-private-chef-a-trend-that-is-sweeping-social-media.html
What an old friendship that has ended says about us,https://english.elpais.com/society/2024-02-05/what-an-old-friendship-that-has-ended-says-about-us.html
Debunking the myth of couples therapy: What if it is the first step towards separation? ,https://english.elpais.com/health/2024-02-05/debunking-the-myth-of-couples-therapy-what-if-it-is-the-first-step-towards-separation.html
Residente: ‘The urban genre fights over nonsense. Nobody says anything about Palestine. I don’t want to belong to that scene’,https://english.elpais.com/culture/2024-02-06/residente-the-urban-genre-fights-over-nonsense-nobody-says-anything-about-palestine-i-dont-want-to-belong-to-that-scene.html
‘Masters of the Air’ looks to the sky to close Steven Spielberg and Tom Hanks’ WW2 trilogy,https://english.elpais.com/culture/2024-02-07/masters-of-the-air-looks-to-the-sky-to-close-steven-spielberg-and-tom-hanks-ww2-trilogy.html
How John Galliano was self-inspired to design Miley Cyrus’ Grammys safety pin dress,https://english.elpais.com/culture/2024-02-06/how-john-galliano-was-self-inspired-to-design-miley-cyrus-grammys-safety-pin-dress.html
"Lily Gladstone, Oscar nominee for ‘Killers of the Flower Moon’: ‘The world has to start getting worried about the return of Trump’",https://english.elpais.com/culture/2024-02-05/lily-gladstone-oscar-nominee-for-killers-of-the-flower-moon-the-world-has-to-start-getting-worried-about-the-return-of-trump.html
"The 3,000-year-old Treasure of Villena contains two pieces made with iron from ‘beyond planet Earth’",https://english.elpais.com/culture/2024-02-05/the-3000-year-old-treasure-of-villena-contains-two-pieces-made-with-iron-from-beyond-planet-earth.html
"Emma Heming, Bruce Willis’ wife, preps guidebook for caregivers: ‘Building a support community has been vital’",https://english.elpais.com/people/2024-02-06/emma-heming-bruce-willis-wife-preps-guidebook-for-caregivers-building-a-support-community-has-been-vital.html
"Toby Keith, country singer-songwriter, dies at 62 after batting stomach cancer ",https://english.elpais.com/people/2024-02-06/toby-keith-country-singer-songwriter-dies-at-62-after-batting-stomach-cancer.html
"The quiet life of Elton John, the singer who resists becoming a legend",https://english.elpais.com/people/2024-02-05/the-quiet-life-of-elton-john-the-singer-who-resists-becoming-a-legend.html
Oscars 2024: Where to stream the nominated movies,https://english.elpais.com/culture/2024-01-26/oscars-2024-where-to-stream-the-nominated-movies.html
Live now in Los40,https://los40.us/ 
"«F*ck the Grammys!»: J Balvin, Ariana Grande & Those Who Declared War Against Them",https://los40.us/2024/fck-the-grammys-j-balvin-ariana-grande-those-who-declared-war-against-them-16602.html
"What Is the ‘Revenge Porn’ That Taylor Swift Is Experiencing, and Why Does It Affect Women?",https://los40.us/2024/what-is-the-revenge-porn-that-taylor-swift-is-experiencing-and-why-does-it-affect-women-16626.html
"2026 World Cup Calendar: Matches, cities and stadiums in the US, Mexico and Canada",https://english.elpais.com/sports/2024-02-06/2026-world-cup-calendar-matches-cities-and-stadiums-in-the-us-mexico-and-canada.html
NBA set to play on an LED glass court for some All-Star weekend events ,https://english.elpais.com/sports/2024-02-05/nba-set-to-play-on-an-led-glass-court-for-some-all-star-weekend-events.html
Super Bowl is expected to smash betting records. 68 million US adults set to wager legally or otherwise ,https://english.elpais.com/sports/2024-02-06/super-bowl-is-expected-to-smash-betting-records-68-million-us-adults-set-to-wager-legally-or-otherwise.html
Super Bowl 2024: Where to watch and everything else you need to know,https://english.elpais.com/sports/2024-01-31/super-bowl-2024-where-to-watch-and-everything-else-you-need-to-know.html
Bukele in El Salvador: The era of the single party and the single leader is born,https://english.elpais.com/international/2024-02-06/bukele-expands-his-power-in-el-salvador-the-era-of-the-single-party-and-the-single-leader-is-born.html
The barrier broken by the woman who reported soccer player Dani Alves for rape: ‘Who is going to believe me?’   ,https://english.elpais.com/spain/2024-02-05/the-barrier-broken-by-the-woman-who-reported-soccer-player-dani-alves-for-rape-who-is-going-to-believe-me.html
"Paulina Tuchschneider, Israeli army deserter and novelist: ‘They called me hysterical for talking about the anxiety of being a soldier’",https://english.elpais.com/culture/2024-02-05/paulina-tuchschneider-israeli-army-deserter-and-novelist-they-called-me-hysterical-for-talking-about-the-anxiety-of-being-a-soldier.html
The epicenter of the catastrophe in Chile: ‘It’s as if a nuclear bomb fell and destroyed us all’,https://english.elpais.com/international/2024-02-06/the-epicenter-of-the-catastrophe-in-chile-its-as-if-a-nuclear-bomb-fell-and-destroyed-us-all.html
EL PAÍS offers free Spanish lessons with Gymglish,https://english.elpais.com/economy-and-business/2021-11-15/el-pais-offers-free-spanish-lessons-with-gymglish.html
Biden wins South Carolina’s Democratic primary as he gears up for his reelection bid,https://english.elpais.com/usa/2024-02-04/biden-wins-south-carolinas-democratic-primary-as-he-gears-up-for-his-reelection-bid.html
Can Trump be on the ballot? It’s the Supreme Court’s biggest election test since Bush v. Gore,https://english.elpais.com/usa/2024-02-03/can-trump-be-on-the-ballot-its-the-supreme-courts-biggest-election-test-since-bush-v-gore.html
Thousands surround the German Parliament against the far right: “We are the firewall”,https://english.elpais.com/international/2024-02-03/thousands-surround-the-german-parliament-against-the-far-right-we-are-the-firewall.html
"Israeli protestors attempt to block aid into Gaza: ‘The enemy is to be killed, not fed’",https://english.elpais.com/international/2024-02-02/israeli-protestors-attempt-to-block-aid-into-gaza-the-enemy-is-to-be-killed-not-fed.html
López Obrador proposes package of constitutional reforms that are both a personal legacy and a campaign program,https://english.elpais.com/international/2024-02-06/lopez-obrador-proposes-package-of-constitutional-reforms-that-are-both-a-personal-legacy-and-a-campaign-program.html
"The tragedy of Viña del Mar: Chile’s ‘garden city’ reduced to smoke, ashes and despair",https://english.elpais.com/international/2024-02-05/the-tragedy-of-vina-del-mar-chiles-garden-city-reduced-to-smoke-ashes-and-despair.html
"Planes, storage, and suppliers nearby: How businesses are dealing with the Red Sea crisis",https://english.elpais.com/economy-and-business/2024-02-05/planes-storage-and-suppliers-nearby-how-businesses-are-dealing-with-the-red-sea-crisis.html
Political storm over the Federal Reserve,https://english.elpais.com/economy-and-business/2024-02-05/political-storm-over-the-federal-reserve.html
Silencing Frank Sinatra: the biggest cringe moment in the history of the Grammys,https://english.elpais.com/culture/2024-02-02/silencing-frank-sinatra-the-biggest-cringe-moment-in-the-history-of-the-grammys.html
What does sadness sound like? The ‘key’ is in 18th century opera ,https://english.elpais.com/society/2024-02-04/what-does-sadness-sound-like-the-key-is-in-18th-century-opera.html
The science of happiness comes under examination,https://english.elpais.com/science-tech/2024-02-05/the-science-of-happiness-comes-under-examination.html
Hug therapy: Volunteers stimulate the development of premature babies in Argentina  ,https://english.elpais.com/health/2024-02-05/hug-therapy-volunteers-stimulate-the-development-of-premature-babies-in-argentina.html
How trauma can reveal personal strength,https://english.elpais.com/health/2024-02-05/how-trauma-can-reveal-personal-strength.html
"Harry James, the influencer who advocates for bald pride",https://english.elpais.com/society/2024-02-03/harry-james-the-influencer-who-advocates-for-bald-pride.html
John McEnroe: ‘Nadal and Saudi Arabia? There is a phrase: money talks’,https://english.elpais.com/sports/2024-01-26/john-mcenroe-nadal-and-saudi-arabia-there-is-a-phrase-money-talks.html
"‘Society of the Snow,’ the spirit of Numa Turcatti and the soccer team named after him",https://english.elpais.com/sports/2024-01-22/society-of-the-snow-the-spirit-of-numa-turcatti-and-the-soccer-team-named-after-him.html
