headline,url
Biden: US will ‘hold all those responsible’ for military deaths in Jordan strike to account ,https://english.elpais.com/international/2024-01-29/biden-us-will-hold-all-those-responsible-for-military-deaths-in-jordan-strike-to-account.html
Guterres asks countries to maintain aid to UN agency for Palestinian refugees,https://english.elpais.com/international/2024-01-29/guterres-asks-countries-to-maintain-aid-to-un-agency-for-palestinian-refugees.html
"The Egyptians who have sent more than 130,000 digital cell phone cards to Gaza to defy blackouts",https://english.elpais.com/international/2024-01-29/the-egyptians-who-have-sent-more-than-130000-digital-cell-phone-cards-to-gaza-to-defy-blackouts.html
Genocide: a crime as difficult to prove as it is to commit,https://english.elpais.com/international/2024-01-29/genocide-a-crime-as-difficult-to-prove-as-it-is-to-commit.html
"An artificial meniscus, 371 days eating toothpaste: Frank Rubio’s adventures in space",https://english.elpais.com/science-tech/2024-01-29/an-artificial-meniscus-and-371-days-of-swallowing-toothpaste-frank-rubios-adventures-in-space.html
The studio where ‘magic’ is made with Hollywood movies and series,https://english.elpais.com/technology/2024-01-29/the-studio-where-magic-is-made-with-hollywood-movies-and-series.html
Oprah Winfrey turns 70 with a $2.8 billion empire and is clearer about things than ever before ,https://english.elpais.com/people/2024-01-29/oprah-winfrey-turns-70-with-a-28-billion-empire-and-is-clearer-about-things-than-ever-before.html
How a Salvadoran gangster duped the Bukele government with a fake scheme to catch an MS-13 fugitive wanted by the US,https://english.elpais.com/international/2024-01-29/how-a-salvadoran-gangster-duped-the-bukele-government-with-a-fake-scheme-to-catch-an-ms-13-fugitive-wanted-by-the-us.html
Ukrainian and Hungarian foreign ministers meet but fail to break a diplomatic deadlock ,https://english.elpais.com/international/2024-01-29/ukrainian-and-hungarian-foreign-ministers-meet-but-fail-to-break-a-diplomatic-deadlock.html
"France’s protesting farmers encircle Paris with tractor barricades, vowing a ‘siege’ over grievances ",https://english.elpais.com/international/2024-01-29/frances-protesting-farmers-encircle-paris-with-tractor-barricades-vowing-a-siege-over-grievances.html
A pinch of salt to improve the tea: The recipe from a US scientist that unleashed the wrath of the UK,https://english.elpais.com/culture/2024-01-29/a-pinch-of-salt-to-improve-the-tea-the-recipe-from-a-us-scientist-that-unleashed-the-wrath-of-the-united-kingdom.html
Defense Secretary Lloyd Austin returns to work at the Pentagon after cancer surgery complications ,https://english.elpais.com/usa/2024-01-29/defense-secretary-lloyd-austin-returns-to-work-at-the-pentagon-after-cancer-surgery-complications.html
Michigan case offers an example of how public trust suffers when police officers lie,https://english.elpais.com/usa/2024-01-29/michigan-case-offers-an-example-of-how-public-trust-suffers-when-police-officers-lie.html
"Child Tax Credit: How to apply, and what changes will it have in 2024 ",https://english.elpais.com/usa/2024-01-26/child-tax-credit-how-to-apply-and-what-changes-will-it-have-in-2024.html
"Who is behind Fleximan, the Italian anti-hero battling speed radars?",https://english.elpais.com/lifestyle/2024-01-29/who-is-behind-fleximan-the-italian-anti-hero-battling-speed-radars.html
"The return of bullfighting to Plaza México, an exercise in freedom, culture and rebellion",https://english.elpais.com/opinion/2024-01-29/the-return-of-bullfighting-to-plaza-mexico-an-exercise-in-freedom-culture-and-rebellion.html
‘I should not have written ‘A Clockwork Orange’’: How Anthony Burgess came to disown his own novel,https://english.elpais.com/culture/2024-01-29/i-should-not-have-written-a-clockwork-orange-how-anthony-burgess-came-to-disown-his-own-novel.html
Why doesn’t Hollywood consider ‘Barbie’ to be a valid movie? How a film that grossed $1.4 billion is still viewed with derision ,https://english.elpais.com/culture/2024-01-29/why-doesnt-hollywood-consider-barbie-to-be-a-valid-movie-how-a-film-that-grossed-14-billion-is-still-viewed-with-derision.html
"‘I’m shit at being anything else other than an actor’: Cillian Murphy, the most humble Oscar nominee in history ",https://english.elpais.com/people/2024-01-29/im-shit-at-being-anything-else-other-than-an-actor-cillian-murphy-the-most-humble-oscar-nominee-in-history.html
How an act of revenge halted construction of a Roman fort on a small Spanish island,https://english.elpais.com/culture/2024-01-29/how-an-act-of-revenge-halted-construction-of-a-roman-fort-on-a-small-spanish-island.html
"Will Taylor Swift go to the Super Bowl? The challenges: a concert, 5,600 miles and 17 time zones",https://english.elpais.com/culture/2024-01-29/will-taylor-swift-go-to-the-super-bowl-the-challenges-a-concert-5600-miles-and-17-time-zones.html
"The second coming of Green Day (and, with them, of pop-punk)",https://english.elpais.com/culture/2024-01-29/the-second-coming-of-green-day-and-with-them-of-pop-punk.html
"Mercè Boada, neurologist: ‘The more we learn about Alzheimer’s, the more able we will be to decide when we want to stop living this way’",https://english.elpais.com/health/2024-01-29/merce-boada-neurologist-the-more-we-learn-about-alzheimers-the-more-able-we-will-be-to-decide-when-we-want-to-stop-living-this-way.html
"Boris Cyrulnik, neuropsychiatrist: ‘There are traumas that the patient cannot talk about, but they can be overcome with sports’  ",https://english.elpais.com/health/2024-01-28/boris-cyrulnik-neuropsychiatrist-there-are-traumas-that-the-patient-cannot-talk-about-but-they-can-be-overcome-with-sports.html
A legendary experiment that began in 1988 suggests that evolution is predictable,https://english.elpais.com/science-tech/2024-01-26/a-legendary-experiment-that-began-in-1988-suggests-that-evolution-is-predictable.html
What happens to your liver when you quit alcohol ,https://english.elpais.com/health/2024-01-26/what-happens-to-your-liver-when-you-quit-alcohol.html
The horrors experienced by Meta moderators: ‘I didn’t know what humans are capable of’,https://english.elpais.com/economy-and-business/2024-01-29/the-horrors-experienced-by-meta-moderators-i-didnt-know-what-humans-are-capable-of.html
Ukraine dreams of reopening its airspace to civil aviation,https://english.elpais.com/international/2024-01-29/ukraine-dreams-of-reopening-its-airspace-to-civil-aviation.html
Amazon calls off bid to buy vacuum maker iRobot amid scrutiny in Europe and the US ,https://english.elpais.com/economy-and-business/2024-01-29/amazon-calls-off-bid-to-buy-vacuum-maker-irobot-amid-scrutiny-in-europe-and-the-us.html
China Evergrande has been ordered to liquidate. The real estate giant owes over $300 billion ,https://english.elpais.com/economy-and-business/2024-01-29/china-evergrande-has-been-ordered-to-liquidate-the-real-estate-giant-owes-over-300-billion.html
Remove stickers fast and without scratching your car with this TikTok trick  ,https://english.elpais.com/lifestyle/2024-01-28/remove-stickers-fast-and-without-scratching-your-car-with-this-tiktok-trick.html
"Why is Gen Z so obsessed with elaborate, full face makeup?  ",https://english.elpais.com/lifestyle/2024-01-28/why-is-gen-z-so-obsessed-with-elaborate-full-face-makeup.html
"Hydrated, but not sticky: The lip oil phenomenon is Gen Z’s new obsession ",https://english.elpais.com/lifestyle/2024-01-27/hydrated-but-not-sticky-the-lip-oil-phenomenon-is-gen-zs-new-obsession.html
Gen Z is sick of there being so much sex everywhere  ,https://english.elpais.com/society/2024-01-25/gen-z-is-sick-of-there-being-so-much-sex-everywhere.html
‘Leave your egos at the door’: The unique night when 80s pop icons recorded ‘We Are The World’,https://english.elpais.com/culture/2024-01-29/leave-your-egos-at-the-door-the-unique-night-when-80s-pop-icons-recorded-we-are-the-world.html
"The teacher, the student and a relationship that was a crime: the real-life case that inspired ‘May December’",https://english.elpais.com/culture/2024-01-29/the-teacher-the-student-and-a-relationship-that-was-a-crime-the-real-life-case-that-inspired-may-december.html
Museums in Europe and the United States confront their colonial past ,https://english.elpais.com/culture/2024-01-28/museums-in-europe-and-the-united-states-confront-their-colonial-past.html
The bittersweet battle of a Spanish filmmaker in Hollywood  ,https://english.elpais.com/culture/2024-01-28/the-bittersweet-battle-of-a-spanish-filmmaker-in-hollywood.html
"Trevor Horn, who composed ‘Video Killed The Radio Star’: ‘I can’t tell the difference between pop singers, everyone uses autotune’",https://english.elpais.com/culture/2024-01-28/trevor-horn-the-man-who-composed-video-killed-the-radio-star-i-cant-tell-the-difference-between-pop-singers-because-everybody-uses-autotune.html
Six great films that turn 50 in 2024 to watch on streaming  ,https://english.elpais.com/culture/2024-01-27/six-great-films-that-turn-50-in-2024-to-watch-on-streaming.html
Cristóbal Balenciaga: an icon on TV as he was in fashion,https://english.elpais.com/culture/2024-01-28/cristobal-balenciaga-an-icon-on-tv-as-he-was-in-fashion.html
"Bradley Cooper and Gigi Hadid confirm relationship, holding hands in London",https://english.elpais.com/people/2024-01-26/bradley-cooper-and-gigi-hadid-confirm-relationship-holding-hands-in-london.html
Oscars 2024: Where to stream the nominated movies,https://english.elpais.com/culture/2024-01-26/oscars-2024-where-to-stream-the-nominated-movies.html
Live now in Los40,https://los40.us/ 
Will Taylor Swift Attend the 2024 Super Bowl?,https://los40.us/2024/will-taylor-swift-attend-the-2024-super-bowl-16372.html
"Anuel AA Makes Big Annoucement: «I’m Going to Debut in Hollywood»

",https://los40.us/2024/anuel-aa-makes-big-annoucement-im-going-to-debut-in-hollywood-16360.html
NFL: MVP favorite Lamar Jackson misses out on the Super Bowl,https://english.elpais.com/sports/2024-01-29/nfl-mvp-favorite-lamar-jackson-misses-out-on-the-super-bowl.html
Figure skater Valieva disqualified in Olympic doping case. Russians set to lose team gold to US ,https://english.elpais.com/sports/2024-01-29/figure-skater-valieva-disqualified-in-olympic-doping-case-russians-set-to-lose-team-gold-to-us.html
The Africa Cup of Nations: When a country’s economy also plays soccer  ,https://english.elpais.com/sports/2024-01-28/the-africa-cup-of-nations-when-a-countrys-economy-also-plays-soccer.html
John McEnroe: ‘Nadal and Saudi Arabia? There is a phrase: money talks’,https://english.elpais.com/sports/2024-01-26/john-mcenroe-nadal-and-saudi-arabia-there-is-a-phrase-money-talks.html
"Bukele, the iron fist leader without rival in El Salvador’s elections",https://english.elpais.com/international/2024-01-28/bukele-the-cool-dictator-unrivaled-at-el-salvadors-elections.html
Inside the Facebook profile of a migrant smuggler,https://english.elpais.com/international/2024-01-28/inside-the-facebook-profile-of-a-migrant-smuggler.html
A children’s army to fight organized crime in Mexico  ,https://english.elpais.com/international/2024-01-26/a-childrens-army-to-fight-organized-crime-in-mexico.html
Naomi Klein: ‘Joe Biden stepping down is the only thing that can stop Trump',https://english.elpais.com/culture/2024-01-23/naomi-klein-joe-biden-stepping-down-is-the-only-thing-that-can-stop-trump-he-has-so-enraged-young-voters-by-supporting-israels-genocide-in-gaza-that-i-doubt-he-can-win.html
EL PAÍS offers free Spanish lessons with Gymglish,https://english.elpais.com/economy-and-business/2021-11-15/el-pais-offers-free-spanish-lessons-with-gymglish.html
Trump’s poor showing among independent voters gives Biden renewed hope,https://english.elpais.com/usa/elections/2024-01-28/trumps-poor-showing-among-independent-voters-gives-biden-renewed-hope.html
"Republicans see an opportunity with Black voters, prompting mobilization in Biden campaign",https://english.elpais.com/usa/elections/2024-01-28/republicans-see-an-opportunity-with-black-voters-prompting-mobilization-in-biden-campaign.html
Liudmila and Gregori’s war: Rebuilding a lifelong home at 70 years old in Ukraine,https://english.elpais.com/international/2024-01-24/liudmila-and-gregoris-war-rebuilding-a-lifelong-home-at-70-years-old-in-ukraine.html
Italy’s lower chamber of parliament OKs deal with Albania to house migrants during asylum processing ,https://english.elpais.com/international/2024-01-24/italys-lower-chamber-of-parliament-oks-deal-with-albania-to-house-migrants-during-asylum-processing.html
The rise of lithium mining threatens the Andean flamingo in Argentina  ,https://english.elpais.com/climate/2024-01-28/the-rise-of-lithium-mining-threatens-the-andean-flamingo-in-argentina.html
Trapped in Guatemala: Venezuelan migrants in limbo,https://english.elpais.com/international/2024-01-28/trapped-in-guatemala-venezuelan-migrants-in-limbo.html
"Deep-sea mining, a murky business for the Global South",https://english.elpais.com/climate/2024-01-28/deep-sea-mining-a-murky-business-for-the-global-south.html
Central banks warn that inflation may pick up: ‘This is not the end of the journey’,https://english.elpais.com/economy-and-business/2024-01-23/central-banks-warn-that-inflation-may-pick-up-this-is-not-the-end-of-the-journey.html
Heavy metal as a form of therapy: Long live metalheads in their forties  ,https://english.elpais.com/culture/2024-01-28/heavy-metal-as-a-form-of-therapy-long-live-metalheads-in-their-forties.html
The musical celebration of the first abolitionist revolts in Haiti  ,https://english.elpais.com/culture/2024-01-26/the-musical-celebration-of-the-first-abolitionist-revolts-in-haiti.html
Will we ever be able to have a conversation with animals?  ,https://english.elpais.com/science-tech/2024-01-26/will-we-ever-be-able-to-have-a-conversation-with-animals.html
"Meet ANYmal, the four-legged robot that could substitute humans in dangerous environments",https://english.elpais.com/technology/2024-01-26/meet-anymal-the-four-legged-robot-that-could-substitute-humans-in-dangerous-environments.html
How to prevent midlife loneliness from getting you down,https://english.elpais.com/health/2024-01-21/how-to-prevent-midlife-loneliness-from-getting-you-down.html
Dancing is an effective way for obese people to lose weight,https://english.elpais.com/health/2024-01-21/dancing-is-an-effective-way-for-obese-people-to-lose-weight.html
"‘Society of the Snow,’ the spirit of Numa Turcatti and the soccer team named after him",https://english.elpais.com/sports/2024-01-22/society-of-the-snow-the-spirit-of-numa-turcatti-and-the-soccer-team-named-after-him.html
Brazilian soccer club president battles 'structural machismo',https://english.elpais.com/sports/2024-01-17/brazilian-soccer-club-president-battles-structural-machismo.html
