headline,url
Ukraine seeks to redirect relationship with Trump to save US aid,https://english.elpais.com/international/2025-03-02/ukraine-seeks-to-redirect-relationship-with-trump-to-save-us-aid.html
,https://english.elpais.com
All quiet on the Hollywood front as the first Trump 2.0 Oscars approach,https://english.elpais.com/culture/2025-03-02/all-quiet-on-the-hollywood-front-as-the-first-trump-20-oscars-approach.html
"Sinaloa, flooded with fentanyl: Mexico hits Los Chapitos in its drug stronghold ",https://english.elpais.com/international/2025-03-02/sinaloa-flooded-with-fentanyl-mexico-hits-los-chapitos-in-its-drug-stronghold.html
"Americans, the migrants with the largest presence in Mexico",https://english.elpais.com/international/2025-03-02/americans-the-migrants-with-the-largest-presence-in-mexico.html
"Andrés Jaque, architect: ‘The street of the future is a bustling street, full of life and shade’ ",https://english.elpais.com/lifestyle/2025-03-02/andres-jaque-architect-the-street-of-the-future-is-a-bustling-street-full-of-life-and-shade.html
,https://english.elpais.com
Life’s revolution: From the selfish gene to the collaborative cell,https://english.elpais.com/science-tech/2025-03-01/lifes-revolution-from-the-selfish-gene-to-the-collaborative-cell.html
Aircraft accidents and what passengers can do to increase their safety in the air,https://english.elpais.com/usa/2025-03-01/aircraft-accidents-and-what-passengers-can-do-to-increase-their-safety-in-the-air.html
"Caro Quintero, Narco of Narcos, the coveted trophy the US has been pursuing for 40 years",https://english.elpais.com
"Guilt, shame and fear of gaining weight: The emotional toll that comes from compulsive eating",https://english.elpais.com/health/2025-03-01/guilt-shame-and-fear-of-gaining-weight-the-emotional-toll-that-comes-from-compulsive-eating.html
"Julián Casanova, historian: ‘The good things Franco did were done by democracies without torture or death sentences’",https://english.elpais.com/culture/2025-03-02/julian-casanova-historian-the-good-things-franco-did-were-done-by-democracies-without-torture-or-death-sentences.html
Teens suffering from obesity have a broken circadian clock ,https://english.elpais.com/health/2025-03-02/teens-suffering-from-obesity-have-a-broken-circadian-clock.html
Can sport make us smarter? ,https://english.elpais.com/science-tech/2025-03-02/can-sport-make-us-smarter.html
Where do the clothes go after we put them in a recycling bin? An 11-month investigation covering thousands of kilometers,https://english.elpais.com/climate/2025-03-01/where-do-the-clothes-go-after-we-put-them-in-a-recycling-bin-an-11-month-investigation-covering-thousands-of-kilometers.html
Science finds explanation for disease that leaves children ‘frozen’ ,https://english.elpais.com/science-tech/2025-02-28/science-finds-explanation-for-disease-that-leaves-children-frozen.html
"Maram Kairé, Senegalese astronomer: ‘The development of the African continent will depend on the space sector’",https://english.elpais.com/science-tech/2025-02-22/maram-kaire-senegalese-astronomer-the-development-of-the-african-continent-will-depend-on-the-space-sector.html
The ones who need little sleep,https://english.elpais.com/science-tech/2025-02-23/the-ones-who-need-little-sleep.html
"Designed by men, for men: Why sex with robots does not have appeal among women",https://english.elpais.com/technology/2025-02-23/designed-by-men-for-men-why-sex-with-robots-does-not-have-appeal-among-women.html
,https://english.elpais.com
Egg prices will increase 41% this year in the US,https://english.elpais.com/economy-and-business/2025-02-27/egg-prices-will-increase-41-this-year-in-the-us-according-to-official-forecasts.html
"Wrestling, cannabis, bitcoin and stocks: This is how Trump’s government of billionaires invests",https://english.elpais.com/economy-and-business/2025-02-15/wrestling-cannabis-bitcoin-and-stocks-this-is-how-trumps-government-of-billionaires-invests.html
Cohousing projects to ease Spain’s real estate crisis,https://english.elpais.com/economy-and-business/2025-02-23/cohousing-projects-to-ease-spains-real-estate-crisis.html
"Dystopias, authoritarianism, technological threats... Is progress over?",https://english.elpais.com/culture/2025-02-25/dystopias-authoritarianism-technological-threats-is-progress-over.html
Underground fights and female thieves: New series from the creator of ‘Peaky Blinders’ delves into London’s underworld,https://english.elpais.com
Hollywood is starring in its own horror movie,https://english.elpais.com/economy-and-business/2025-02-15/hollywood-is-starring-in-its-own-horror-movie.html
Patrick Dempsey: ‘Dyslexia was a lesson in humility that saved me from the temptation to believe I was better than anyone else’,https://english.elpais.com/culture/2025-02-19/patrick-dempsey-dyslexia-was-a-lesson-in-humility-that-saved-me-from-the-temptation-to-believe-i-was-better-than-anyone-else.html
"Tiny Desk, what a concept: 15 performances that will ignite your love of music",https://english.elpais.com/culture/2025-02-23/tiny-desk-what-a-concept-15-performances-that-will-ignite-your-love-of-music.html
Dexter’s father: How to raise a psychopath ,https://english.elpais.com/culture/2025-02-16/dexters-father-how-to-raise-a-psychopath.html
,https://english.elpais.com
The popularity of the ‘Mar-a-Lago face’ soars in Trump’s inner circle,https://english.elpais.com/lifestyle/2025-02-24/the-popularity-of-the-mar-a-lago-face-soars-in-trumps-inner-circle.html
"Wasting time, no social media, having kids and knowing the hidden spots: The true luxuries of the super-rich in 2025",https://english.elpais.com
"Even if they won’t admit it, parents do indeed have a favorite child ",https://english.elpais.com/health/2025-02-23/even-if-they-wont-admit-it-parents-do-indeed-have-a-favorite-child.html
"Noah Centineo, the actor who went from the internet’s boyfriend to near-oblivion  ",https://english.elpais.com/people/2025-02-08/noah-centineo-the-actor-who-went-from-the-internets-boyfriend-to-near-oblivion.html
"Jacques Audiard, director of ‘Emilia Pérez’, distances himself from Karla Sofía Gascón: ‘What she said is inexcusable’",https://english.elpais.com/culture/2025-02-05/jacques-audiard-director-of-emilia-perez-distances-himself-from-karla-sofia-gascon-what-she-said-is-inexcusable.html
"The second youth of Lindsey Buckingham, Fleetwood Mac’s sonic architect",https://english.elpais.com/culture/2025-02-15/the-second-youth-of-lindsey-buckingham-fleetwood-macs-sonic-architect.html
News of a stagnant war in Sinaloa,https://english.elpais.com/international/2025-02-17/news-of-a-stagnant-war-in-sinaloa.html
Salman Rushdie: ‘Musk does not defend freedom of expression; he curates the discourse of the extreme right’  ,https://english.elpais.com/culture/2025-02-16/salman-rushdie-musk-does-not-defend-freedom-of-expression-he-curates-the-discourse-of-the-extreme-right.html
Jocelynn took her own life after being harassed at school because of her family’s immigration status: ‘Why was I left without my princess?’,https://english.elpais.com
Not just ships: The expansion of the Panama Canal also facilitates the transit of invasive fish,https://english.elpais.com/science-tech/2025-02-24/not-just-ships-the-expansion-of-the-panama-canal-also-facilitates-the-transit-of-invasive-fish.html
Listen now LOS40 USA,https://los40.us/
One Direction’s Decision About Reuniting for the BRITs as a Tribute to Liam Payne,https://los40.us/2025/one-directions-decision-about-reuniting-for-the-brits-as-a-tribute-to-liam-payne-30371.html
Kendrick Lamar’s Photos at UCLA Go Viral: What’s He Studying?,https://los40.us/2025/kendrick-lamars-photos-at-ucla-go-viral-whats-he-studying-30277.html
EL PAÍS offers free Spanish lessons with Gymglish,https://english.elpais.com
‘A legal black box’: Trump uses treatment reserved for terrorists on migrants sent to Guantánamo,https://english.elpais.com/international/2025-02-13/a-legal-black-box-trump-uses-treatment-reserved-for-terrorists-on-migrants-sent-to-guantanamo.html
,https://english.elpais.com
‘Canada is not for sale’: Trump’s threats of annexation and tariffs stoke Canadian patriotism,https://english.elpais.com/international/2025-02-10/canada-is-not-for-sale-trumps-threats-of-annexation-and-tariffs-stoke-canadian-patriotism.html
"ICE jacket becomes a best-seller on Amazon: ‘If you want some entertainment, wear this and watch illegals run away’",https://english.elpais.com/usa/2025-02-26/ice-jacket-becomes-a-best-seller-on-amazon-if-you-want-some-entertainment-wear-this-and-watch-illegals-run-away.html
Sheinbaum’s dilemma after ‘El Mayo’ Zambada’s latest letter: intervene or placate Trump,https://english.elpais.com/international/2025-02-25/sheinbaums-dilemma-after-el-mayo-zambadas-latest-letter-intervene-or-placate-trump.html
Venezuela kicks off its most uncertain presidential campaign,https://english.elpais.com/international/2025-02-25/the-most-coveted-trophy-europeans-and-asians-embrace-illegal-jaguar-hunting-in-bolivia.html
,https://english.elpais.com
An economic paradox: When savings are both a good and a bad idea,https://english.elpais.com
"Ai Weiwei: ‘In the art world, everyone talks about money. It’s poisonous; you’re only worth as much as your work’  ",https://english.elpais.com/culture/2025-02-15/ai-weiwei-in-the-art-world-everyone-talks-about-money-its-poisonous-youre-only-worth-as-much-as-your-work.html
,https://english.elpais.com
"Rafael López, oncologist: ‘With a blood test we expect to be able to identify the weaknesses of almost all tumors’",https://english.elpais.com/health/2025-02-21/rafael-lopez-oncologist-with-a-blood-test-we-expect-to-be-able-to-identify-the-weaknesses-of-almost-all-tumors.html
"Ramón Bataller, hepatologist: ‘The combination of alcohol and cocaine is explosive and many young people are paying for it’",https://english.elpais.com/health/2025-02-08/ramon-bataller-hepatologist-the-combination-of-alcohol-and-cocaine-is-explosive-and-many-young-people-are-paying-for-it.html
The best Irish wine is made by a Spanish couple,https://english.elpais.com/lifestyle/2025-01-29/the-best-irish-wine-is-made-by-a-spanish-couple.html
My therapist is a bot: The rise of AI in mental health treatment,https://english.elpais.com/technology/2025-01-21/my-therapist-is-a-bot-the-rise-of-ai-in-mental-health-treatment.html
,https://english.elpais.com
"Climbing without a rope, between freedom and psychopathy",https://english.elpais.com
